{
  "corpusId": "canonical_female_pose_corpus_v0_1",
  "counts": {
    "acceptedRenders": 0,
    "blockedSourceDefectRenders": 5,
    "candidatesProduced": 123,
    "mechanicsResolved": 0,
    "registered": 123,
    "reviewRequiredRenders": 118
  },
  "entries": [
    {
      "acceptance": {
        "mechanicsStatus": "review_required",
        "qaStatus": "passed_transform_checks",
        "registrationStatus": "registered",
        "renderStatus": "review_required",
        "workflowValidationStatus": "not_validated"
      },
      "entryId": "set_a_pose_001",
      "entrySha256": "3fd3b2a4bd9018d618c367c5230ad04802e03d26c55c4fa91a8dc9885456db2b",
      "ordinal": 1,
      "originalLabel": "overhead_side_lean_a",
      "overrideSha256": "0e605da538ebfb42b5d74e77be22d0a0b37fd9baba5b86358c644e5f994071ea",
      "pathKey": "set_a",
      "proposalSha256": "521ea7513899e532103490545893aba4b8cbae0ffc3de2e0db49392bb0eabcf9",
      "renderOutput": {
        "decodedPixelSha256": "4ede6ce70b2e24853b3dea26b9414cf284ffc83643ae08c0c389074123b88391",
        "heightPx": 2112,
        "logicalPath": "review/previews/set_a/set_a_pose_001.png",
        "mode": "RGBA",
        "sha256": "d97e1fc8ffe01c667ca4b2f7dc6870b26c34b99c7e53353b7c79642a1f485e5c",
        "storageClass": "external_generated",
        "widthPx": 1536
      },
      "renderRecordSha256": "64b3396dd5075b4f4619ce8d394c0cfd85a4fa10db458e3ffff27badf16e6fac",
      "sourceEntrySha256": "4684d837d287d63f3ed62bcf386a3cf860db08d19b82e553446a235bdc8144f6",
      "sourceSetId": "set_a_edge_extremity_refined_v1"
    },
    {
      "acceptance": {
        "mechanicsStatus": "review_required",
        "qaStatus": "passed_transform_checks",
        "registrationStatus": "registered",
        "renderStatus": "review_required",
        "workflowValidationStatus": "not_validated"
      },
      "entryId": "set_a_pose_002",
      "entrySha256": "721e265a040a9c80897f44e0fcbb556b43204907d0f65db64691ea6b96b75255",
      "ordinal": 2,
      "originalLabel": "overhead_center",
      "overrideSha256": "56af0fd3080c1ba7d896d06b96feea6f0c2a60a21602aaad1fcf62dd1c87d086",
      "pathKey": "set_a",
      "proposalSha256": "b5f994cd1cd13755fefcf2cdfa94ff4a18a4bb01b33fa34ed60b20913d04a9b6",
      "renderOutput": {
        "decodedPixelSha256": "cc325a113d5e0cd0242e9a073d9e7f863dda0b984c630bad05136f2046e0a729",
        "heightPx": 2112,
        "logicalPath": "review/previews/set_a/set_a_pose_002.png",
        "mode": "RGBA",
        "sha256": "6645e1884163636441ed1135058499f8ddd607e5adcfe7bf817d01551c5df507",
        "storageClass": "external_generated",
        "widthPx": 1536
      },
      "renderRecordSha256": "59fee7e997ab820ff9665b525739d32d8598d910bbd19ec75372bc91bb02b108",
      "sourceEntrySha256": "3224851ad0ccf777160f4a003834adcaeed9a7537b77158f772d6c1d10485ef0",
      "sourceSetId": "set_a_edge_extremity_refined_v1"
    },
    {
      "acceptance": {
        "mechanicsStatus": "review_required",
        "qaStatus": "passed_transform_checks",
        "registrationStatus": "registered",
        "renderStatus": "review_required",
        "workflowValidationStatus": "not_validated"
      },
      "entryId": "set_a_pose_003",
      "entrySha256": "a6474bf6ae629c123d55bc3c38fe654debf85d5ee970f727c22f2f111558d7fb",
      "ordinal": 3,
      "originalLabel": "raised_knee_arms_high",
      "overrideSha256": "557e4939f6d058b22ffdc870d976c96d352e7a23e6743e540b87376b87296618",
      "pathKey": "set_a",
      "proposalSha256": "e54afeb3d3eea5425c7a7f7730bfdebe2e5334b1558f5df47af51c2b90c14acc",
      "renderOutput": {
        "decodedPixelSha256": "bda4d35275b7bf4077720e41b2983a25ad3180cee50d06d8d8acbdc6adc6ea66",
        "heightPx": 2112,
        "logicalPath": "review/previews/set_a/set_a_pose_003.png",
        "mode": "RGBA",
        "sha256": "02bc81022f5629913f9405af91f87505b7513888d210d25ce075ca728d74448e",
        "storageClass": "external_generated",
        "widthPx": 1536
      },
      "renderRecordSha256": "7f1751cb69187185ccf8255152eeba35391353d503d7167423c60d2246d56380",
      "sourceEntrySha256": "8a2baf31b10aec506ce5952997e2249a23b3671cb1aeaf1baa3efdf3eda75aca",
      "sourceSetId": "set_a_edge_extremity_refined_v1"
    },
    {
      "acceptance": {
        "mechanicsStatus": "review_required",
        "qaStatus": "passed_transform_checks",
        "registrationStatus": "registered",
        "renderStatus": "review_required",
        "workflowValidationStatus": "not_validated"
      },
      "entryId": "set_a_pose_004",
      "entrySha256": "07484198a611389751ab143db693eed8f4f2cad36ca1fe6f692ade36fe067e1b",
      "ordinal": 4,
      "originalLabel": "hands_up_cross_step",
      "overrideSha256": "eca6d70b0a201e172ab1888056dc55279a1e4ae2110478b7dde0a06c3a195d61",
      "pathKey": "set_a",
      "proposalSha256": "0674d4b7719f08ad44993dfdb920dc4c4eb384ccc211ffcdc22c720fff6f69fe",
      "renderOutput": {
        "decodedPixelSha256": "28b0011e18737d587762f63feb4166ab4a482803432719906f790cc2e0308780",
        "heightPx": 2112,
        "logicalPath": "review/previews/set_a/set_a_pose_004.png",
        "mode": "RGBA",
        "sha256": "cd9f3c3583e3c0055fb2fa18961d89e3fbc1417f42fd6ec7cbf987d9bc12d066",
        "storageClass": "external_generated",
        "widthPx": 1536
      },
      "renderRecordSha256": "d80fa9e7f8a86a5e2a6e7cb8ee981f507aef14e6af0fbe3e5f68803927b146e9",
      "sourceEntrySha256": "323b699bafa78326c18473c72b5b27b7bc68b76f20e8b8a52c1a5c637442542d",
      "sourceSetId": "set_a_edge_extremity_refined_v1"
    },
    {
      "acceptance": {
        "mechanicsStatus": "review_required",
        "qaStatus": "passed_transform_checks",
        "registrationStatus": "registered",
        "renderStatus": "review_required",
        "workflowValidationStatus": "not_validated"
      },
      "entryId": "set_a_pose_005",
      "entrySha256": "66b93cd6315fb87aa626e905aa69f3051ede216e262eb5da90f2b8ec55620428",
      "ordinal": 5,
      "originalLabel": "open_palms_hip_shift",
      "overrideSha256": "6b6ddc89d4632f71970bbaff06e867a3d255bdefc38cfeee47ce5c5344958e1a",
      "pathKey": "set_a",
      "proposalSha256": "4de6d35d3e8acb4a71cc304259470dc11ac32a9350b86c3cfac51c908b1bb9f5",
      "renderOutput": {
        "decodedPixelSha256": "26a833722a90fae485751c511a8a079025f04ef90d91bf74b610b6710a3594c3",
        "heightPx": 2112,
        "logicalPath": "review/previews/set_a/set_a_pose_005.png",
        "mode": "RGBA",
        "sha256": "8a94bf1c2ed95af29d7b20830edde67322667cd1bcb52883d79fc783b9152872",
        "storageClass": "external_generated",
        "widthPx": 1536
      },
      "renderRecordSha256": "0a2c1f01d3a043c7f8251907c5b3761596541d4fbf30d4086439a0748cd73207",
      "sourceEntrySha256": "3a92be7eb5b4717fde79f0ce7ac9d657490cea6ab80ec0d14099f0b6754b4115",
      "sourceSetId": "set_a_edge_extremity_refined_v1"
    },
    {
      "acceptance": {
        "mechanicsStatus": "review_required",
        "qaStatus": "passed_transform_checks",
        "registrationStatus": "registered",
        "renderStatus": "review_required",
        "workflowValidationStatus": "not_validated"
      },
      "entryId": "set_a_pose_006",
      "entrySha256": "9963bae895a7bafe2b568ee3338990e4c142af44ba29c5bc72d374bde2e7acf9",
      "ordinal": 6,
      "originalLabel": "bent_wrists_front",
      "overrideSha256": "0f352f12b2c21bc246723bbe40540f28960c833fbd8522686d18e36cd6b6a26c",
      "pathKey": "set_a",
      "proposalSha256": "65ab19e578f2efeae9a34a3ac4e924748eb325a6abb16f456a1f3e61c771f9cb",
      "renderOutput": {
        "decodedPixelSha256": "592dc08e461b7f5a261c0f6770b10b80d68daae839fd55f6a2096d0a493ab0fb",
        "heightPx": 2112,
        "logicalPath": "review/previews/set_a/set_a_pose_006.png",
        "mode": "RGBA",
        "sha256": "0e239a4f06ac8daef51564bcb9766e80d3679b4a7896d78803048de3bc3e003b",
        "storageClass": "external_generated",
        "widthPx": 1536
      },
      "renderRecordSha256": "a38d01a64d68675aa8a9454648eaf644ff0a2570f68d28c6a904aacdb167776d",
      "sourceEntrySha256": "8d8b55bdab859743d60676e14d1940a43859eabdf70ca53c3b4f2a43f2ab4e5a",
      "sourceSetId": "set_a_edge_extremity_refined_v1"
    },
    {
      "acceptance": {
        "mechanicsStatus": "review_required",
        "qaStatus": "passed_transform_checks",
        "registrationStatus": "registered",
        "renderStatus": "review_required",
        "workflowValidationStatus": "not_validated"
      },
      "entryId": "set_a_pose_007",
      "entrySha256": "097a9496413faf2e610e19ae9d16188e8e2d8b290bff1b003350a46ca49290eb",
      "ordinal": 7,
      "originalLabel": "palms_out_crouch",
      "overrideSha256": "4a4c2716be64cdaea483b3f108c063af05555febc8b080b0dbb80d64c7df9b67",
      "pathKey": "set_a",
      "proposalSha256": "0867a3198f1d38412ef1e985979f55332a25d28222e77648b0e7d75fc9f9c708",
      "renderOutput": {
        "decodedPixelSha256": "c8216d2240adadf4c14e458aaa6e5474b949f46b6fa039c48f204d00a53a8b6c",
        "heightPx": 2112,
        "logicalPath": "review/previews/set_a/set_a_pose_007.png",
        "mode": "RGBA",
        "sha256": "aeb0d1b36a8697d51c6b54b7ee0404ebc2b0bcc55467a15faaceb74d47a085c7",
        "storageClass": "external_generated",
        "widthPx": 1536
      },
      "renderRecordSha256": "394bfe59b9d022a802531123e8c501fee182de251d295bcd1fbae1b87e142913",
      "sourceEntrySha256": "59917db239c9e211a689a1a14ff7bd725ec9f9217ce7160f3d48a818246a16ad",
      "sourceSetId": "set_a_edge_extremity_refined_v1"
    },
    {
      "acceptance": {
        "mechanicsStatus": "review_required",
        "qaStatus": "passed_transform_checks",
        "registrationStatus": "registered",
        "renderStatus": "review_required",
        "workflowValidationStatus": "not_validated"
      },
      "entryId": "set_a_pose_008",
      "entrySha256": "779ecbde60444780180be066082278c2dfadfedc59a3b50b16310a1205b20d6f",
      "ordinal": 8,
      "originalLabel": "angled_hands_side",